{
  "$schema": "./latest.schema.json",
  "channel": "stable",
  "version": "0.0.0",
  "buildNumber": 0,
  "releasedAt": "1970-01-01T00:00:00Z",
  "minSupportedBuild": 0,
  "releaseUrl": "https://github.com/rapidshyft/TryGradeX/releases/tag/v0.0.0",
  "notes": "Placeholder. Replaced by the release worker on the first release.",
  "checksumsUrl": "https://github.com/rapidshyft/TryGradeX/releases/download/v0.0.0/SHA256SUMS.txt",
  "android": {
    "applicationId": "com.rapidshyft.gradex",
    "minSdk": 28,
    "artifacts": {
      "universal": {
        "name": "gradex-0.0.0-universal.apk",
        "url": "https://github.com/rapidshyft/TryGradeX/releases/download/v0.0.0/gradex-0.0.0-universal.apk",
        "sha256": "0000000000000000000000000000000000000000000000000000000000000000",
        "size": 0
      },
      "arm64-v8a": {
        "name": "gradex-0.0.0-arm64-v8a.apk",
        "url": "https://github.com/rapidshyft/TryGradeX/releases/download/v0.0.0/gradex-0.0.0-arm64-v8a.apk",
        "sha256": "0000000000000000000000000000000000000000000000000000000000000000",
        "size": 0
      },
      "armeabi-v7a": {
        "name": "gradex-0.0.0-armeabi-v7a.apk",
        "url": "https://github.com/rapidshyft/TryGradeX/releases/download/v0.0.0/gradex-0.0.0-armeabi-v7a.apk",
        "sha256": "0000000000000000000000000000000000000000000000000000000000000000",
        "size": 0
      },
      "x86_64": {
        "name": "gradex-0.0.0-x86_64.apk",
        "url": "https://github.com/rapidshyft/TryGradeX/releases/download/v0.0.0/gradex-0.0.0-x86_64.apk",
        "sha256": "0000000000000000000000000000000000000000000000000000000000000000",
        "size": 0
      }
    }
  }
}
